{
  "schemaVersion": 1,
  "kind": "agent-runtime-tool-inventory",
  "runtime": "claude",
  "capturedAt": "2026-10-24T00:05:00.000Z",
  "captureMethod": "runtime-adapter",
  "servers": [
    {
      "name": "reviewed",
      "toolCount": 2
    },
    {
      "name": "unknown",
      "toolCount": 1
    },
    {
      "name": "unexpected",
      "toolCount": 1
    }
  ]
}
